Pipeline,Type,Affected Parameter,Formula,Reasoning
B; C/Pydantic,Range,enddls,"[1,366]",Day of the year.
B; C/Pydantic,Range,startdls,"[1,366]",Day of the year.
C/Pydantic,Range,pormax_dec,"[0.1,0.9]","Realistic interior band of (0,1) for deciduous trees porosity."
C/Pydantic,Range,pormin_dec,"[0.1,0.9]","Realistic interior band of (0,1) for deciduous trees porosity."
C/Pydantic,Range,rainmaxres,"[0,20]", Realistic rain‑intensity range for residential surfaces.
B; C/Pydantic,Range,lat,"[-90,90]",Latitude.
B; C/Pydantic,Range,lng,"[-180,180]",Longitude.
C/Pydantic,Minimum Value,soilstore,>=10,Ensures the soil is not unrealistically dry at initialisation (stability convenience).